doc_id,filename,file_type,file_size,char_count,path,folder,status,include,content_type,sensitivity_flag,summary,topic_tags,audience,preprocessing_complete,extraction_quality,processed_char_count,chunking_complete,chunk_count
doc_001,Summary.md,md,20517,,/Users/eduardolizana/Documents/6. Companies /1. Companies with Rodrigo/KeepMeCompany/Summary.md,.,triaged,yes,mixed,yes,"This document serves as internal resume raw material summarizing KeepMeCompany's AI-powered healthcare platform for NHS GP practices. It details the product suite including intake, follow-up, and crisis detection systems, alongside the specific Python and Voice AI tech stack used. The content outlines regulatory status, operational metrics, and technical architecture for employee reference.","HealthTech,AI_Voice_Agents,NHS,Tech_Stack,Medical_Device",internal,,,,,
doc_002,Cold Call Script – GP Practices (Manchester).docx,docx,8798,,/Users/eduardolizana/Documents/6. Companies /1. Companies with Rodrigo/KeepMeCompany/4. Sales/Cold Call Script – GP Practices (Manchester).docx,4. Sales,triaged,yes,mixed,yes,"The document outlines a cold calling script for contacting GP practices in Manchester to pitch KeepMeCompany's AI anamnesis service, including specific dialogue for handling receptionists. It also lists interview questions for a Sales & Business Development role, focusing on industry knowledge, tech aptitude, and resilience. This material reflects the company's go-to-market strategy and hiring criteria for expanding into NHS practices.","Sales Strategy,Hiring,NHS Outreach,AI Value Proposition,Cold Calling",internal,,,,,
doc_003,Cold email templates.docx,docx,14383,,/Users/eduardolizana/Documents/6. Companies /1. Companies with Rodrigo/KeepMeCompany/4. Sales/Cold email templates.docx,4. Sales,triaged,yes,prose,no,"This document contains a collection of cold email templates designed for selling AI-driven voice services to private clinics and dental practices. It outlines value propositions focused on patient loyalty, reduced admin burden, and includes a brief case study about a dentist named Emma. The text ends abruptly, suggesting it may be a draft or incomplete export.","sales-templates,AI-voice,private-healthcare,cold-outreach,value-proposition",internal,,,,,
doc_004,Ideas to meet decision makers - Public UK_.docx,docx,293410,,/Users/eduardolizana/Documents/6. Companies /1. Companies with Rodrigo/KeepMeCompany/4. Sales/Ideas to meet decision makers - Public UK_.docx,4. Sales,triaged,yes,mixed,no,"This document outlines internal sales strategies for targeting UK GP practices and Practice Managers, including ideas for networking events and pilot programs. It contains draft email templates designed to pitch the AI phone agent tool to healthcare providers, focusing on QOF deadlines and workload reduction. Feedback from a stakeholder requests more concrete targeting lists and specific contact methods for PCNs and practices in Manchester.","Sales Strategy,NHS Outreach,Email Templates,Go-to-Market,GP Practices",internal,,,,,
doc_005,KeepMeCompany - Commercial Presentation.pptx,pptx,921219,,/Users/eduardolizana/Documents/6. Companies /1. Companies with Rodrigo/KeepMeCompany/4. Sales/KeepMeCompany - Commercial Presentation.pptx,4. Sales,triaged,yes,mixed,yes,"This document is a commercial sales presentation outlining KeepMeCompany's AI receptionist service for NHS GP practices. It details the pricing model, operational integration steps, and projected efficiency gains for receptionists. It also includes critical legal disclaimers regarding clinical liability and emergency response protocols.","AI Receptionist,GP Practice Operations,Pricing Model,Legal Disclaimer,Telephony Integration",internal,,,,,
doc_006,KeepMeCompany - Pilot Proposal.pptx,pptx,887038,,/Users/eduardolizana/Documents/6. Companies /1. Companies with Rodrigo/KeepMeCompany/4. Sales/KeepMeCompany - Pilot Proposal.pptx,4. Sales,triaged,yes,structured,yes,"This document outlines a pilot proposal for KeepMeCompany's AI-driven communication platform aimed at NHS GP practices. It details the pilot objectives, resource commitments from staff, and projected ROI regarding time savings and QOF targets. Compliance standards such as Cyber Essentials and Class I Medical Device classification are also highlighted.","Pilot Proposal,NHS GP,AI Telephony,Sales Strategy,Compliance",internal,,,,,
doc_007,KeepMeCompany vs Competition Table.xlsx,xlsx,5882,,/Users/eduardolizana/Documents/6. Companies /1. Companies with Rodrigo/KeepMeCompany/4. Sales/KeepMeCompany vs Competition Table.xlsx,4. Sales,triaged,yes,structured,yes,"This document is a competitive analysis spreadsheet comparing KeepMeCompany against a competitor named Voice Connect. It outlines key differentiators, certifications, and quantified metrics regarding time and cost savings for GP practices. The table includes specific financial figures for monthly costs and net savings per month.","Competitive Analysis,Sales Metrics,Financial Data,Healthcare Compliance,Value Proposition",internal,,,,,
doc_008,Sales - Source of Truth.docx,docx,6386,,/Users/eduardolizana/Documents/6. Companies /1. Companies with Rodrigo/KeepMeCompany/4. Sales/Sales - Source of Truth.docx,4. Sales,excluded-bad-extraction,no,,,File could not be read (empty or unsupported format),,,,,,,
doc_009,Brand & Marketing Strategy.docx,docx,11546,,/Users/eduardolizana/Documents/6. Companies /1. Companies with Rodrigo/KeepMeCompany/4. Sales/6. Marketing/Brand & Marketing Strategy.docx,4. Sales/6. Marketing,triaged,yes,mixed,no,"This document outlines the brand and marketing strategy for KeepMeCompany, positioning AI as an extension of human healthcare capabilities rather than a replacement. It defines target audiences including NHS decision-makers and practice managers, along with tone guidelines and a phased content evolution plan. The strategy establishes specific value propositions regarding efficiency and patient engagement for both public and private healthcare sectors.","Brand Strategy,Marketing,NHS,Healthcare AI,Value Proposition",internal,,,,,
doc_010,Marketing Plan.xlsx,xlsx,60375,,/Users/eduardolizana/Documents/6. Companies /1. Companies with Rodrigo/KeepMeCompany/4. Sales/6. Marketing/Marketing Plan.xlsx,4. Sales/6. Marketing,triaged,yes,structured,no,"This Excel spreadsheet serves as a marketing content calendar for KeepMeCompany, detailing weekly themes and targets for outreach to GP practices and clinics. It outlines strategic messaging pillars focused on efficiency, human connection, and senior care quality within the UK healthcare system. Specific topics include the 'Loneliness Prescription' and the distinction between automation and augmentation in medical AI.","Marketing Strategy,AI Healthcare,NHS GP Practices,Content Calendar,Value Proposition",internal,,,,,
doc_011,List of patients - The Female Doctor - List of patients (1).csv,csv,52869,,/Users/eduardolizana/Documents/6. Companies /1. Companies with Rodrigo/KeepMeCompany/4. Sales/9. Customers Information/List of patients - The Female Doctor - List of patients (1).csv,4. Sales/9. Customers Information,triaged,no,structured,yes,"This document is a CSV export containing contact information for potential leads or customers, including names, phone numbers, and email addresses. It includes CRM metadata such as creation dates, last activity timestamps, and campaign tags. The data appears to be a raw database dump from a sales system.","pii,sales-data,crm-export,customer-list,raw-data",internal,,,,,
doc_012,List of patients - The Female Doctor - List of patients (1).xlsx,xlsx,30595,,/Users/eduardolizana/Documents/6. Companies /1. Companies with Rodrigo/KeepMeCompany/4. Sales/9. Customers Information/List of patients - The Female Doctor - List of patients (1).xlsx,4. Sales/9. Customers Information,triaged,no,structured,yes,"This document is a raw CRM export containing a list of individuals with contact details including names, phone numbers, and email addresses. It includes metadata such as creation dates, last activity timestamps, and lead tags like 'new lead' and 'active campaign'. Although the filename references 'patients', the content appears to be sales leads or contacts stored in the Customers Information folder.","CRM Export,PII,Sales Data,Customer Information,Raw Data",internal,,,,,
doc_013,List of patients - The Female Doctor.xlsx,xlsx,32154,,/Users/eduardolizana/Documents/6. Companies /1. Companies with Rodrigo/KeepMeCompany/4. Sales/9. Customers Information/List of patients - The Female Doctor.xlsx,4. Sales/9. Customers Information,triaged,no,structured,yes,"This document is a raw Excel spreadsheet export containing contact records with names, phone numbers, and email addresses. It includes metadata such as creation dates, last activity timestamps, and CRM tags like 'new lead' and 'active campaign'.","CRM Data,PII,Sales Leads,GDPR Risk,Customer Information",internal,,,,,
doc_014,List of patients.csv,csv,55390,,/Users/eduardolizana/Documents/6. Companies /1. Companies with Rodrigo/KeepMeCompany/4. Sales/9. Customers Information/List of patients.csv,4. Sales/9. Customers Information,triaged,no,structured,yes,"This document is a CSV export of contact records containing names, phone numbers, and email addresses. It includes metadata such as creation dates, last activity timestamps, and campaign tags like 'new lead' and 'active campaign'. The data appears to be a sales CRM list rather than clinical patient records despite the filename.","sales,crm,pii,customer_data,leads",internal,,,,,
doc_015,Planilla pacientes K2.xlsx,xlsx,36020,,/Users/eduardolizana/Documents/6. Companies /1. Companies with Rodrigo/KeepMeCompany/4. Sales/9. Customers Information/Planilla pacientes K2.xlsx,4. Sales/9. Customers Information,triaged,no,structured,yes,"This spreadsheet contains a raw list of patient records for a clinic labeled 'K2', including names, phone numbers, and email addresses. The data appears to originate from Chile based on phone country codes, contrasting with the startup's UK NHS focus. It serves as operational customer data rather than strategic business documentation.","patient_records,pii,customer_data,spreadsheet,operational",internal,,,,,
doc_016,Notices - UK Dec 4th.xlsx,xlsx,701257,,/Users/eduardolizana/Documents/6. Companies /1. Companies with Rodrigo/KeepMeCompany/4. Sales/2. Tenders/Notices - UK Dec 4th.xlsx,4. Sales/2. Tenders,triaged,no,structured,no,"This Excel file lists UK public procurement notices for construction works, specifically cladding and roofing projects managed by Hampshire County Council and Arun District Council. It contains structured data regarding contract values, deadlines, and contact details for external tenders. The document does not contain any information regarding KeepMeCompany's internal operations or AI health-tech products.","public-procurement,tenders,construction,uk-government,raw-data",internal,,,,,
doc_017,Tender - UK List.docx,docx,13304,,/Users/eduardolizana/Documents/6. Companies /1. Companies with Rodrigo/KeepMeCompany/4. Sales/2. Tenders/Tender - UK List.docx,4. Sales/2. Tenders,triaged,yes,mixed,no,"This document is an internal sales list of UK NHS tender notices and market engagement opportunities relevant to health technology providers. It details specific projects such as AI triage services, dementia support, and hospital discharge assistance, including contact emails and submission deadlines. Internal notes are interspersed, evaluating the validity of certain opportunities for the startup.","NHS Tenders,Market Intelligence,Health Tech,Sales Pipeline,AI Healthcare",internal,,,,,
doc_018,Spain Communication Services - Sales Playbook.docx,docx,899559,,/Users/eduardolizana/Documents/6. Companies /1. Companies with Rodrigo/KeepMeCompany/4. Sales/5. Spanish Private Market/Spain Communication Services - Sales Playbook.docx,4. Sales/5. Spanish Private Market,triaged,yes,mixed,yes,"This document is an internal sales playbook for KeepMeCompany's AI communication services targeting private clinics in Spain. It details sales scripts, value propositions, demo workflows, and pricing strategies (€0.53 per call). It also addresses data privacy compliance and common customer objections regarding the AI phone agent technology.","Sales Strategy,AI Healthcare,Pricing Model,Patient Adherence,Market Expansion",internal,,,,,
doc_019,Spanish Private Clinics Research.docx,docx,202420,,/Users/eduardolizana/Documents/6. Companies /1. Companies with Rodrigo/KeepMeCompany/4. Sales/5. Spanish Private Market/Spanish Private Clinics Research.docx,4. Sales/5. Spanish Private Market,triaged,maybe,mixed,yes,"This document provides a market analysis of the Spanish private healthcare sector, detailing clinic distribution, profit margins, and technology adoption trends. It outlines sales preferences and decision-making processes specific to Spanish private clinics rather than the UK NHS. The content focuses on business models and competitive landscape within Spain.","Market Research,International Expansion,Healthcare Analytics,Sales Strategy,Spain",internal,,,,,
doc_020,Tablas Playbook - Spanish Private Market.xlsx,xlsx,5619,,/Users/eduardolizana/Documents/6. Companies /1. Companies with Rodrigo/KeepMeCompany/4. Sales/5. Spanish Private Market/Tablas Playbook - Spanish Private Market.xlsx,4. Sales/5. Spanish Private Market,triaged,yes,structured,no,"This document outlines a sales playbook detailing specific use cases for AI agents across various medical specialties within the Spanish private market. It categorizes capabilities into appointment reminders, post-consultation follow-ups, and recurrent monitoring for providers like dentists, dermatologists, and general practitioners. The table serves as a reference for positioning the product's value proposition in non-NHS healthcare settings.","Sales Playbook,Use Cases,Spanish Market,Medical Specialties,Product Strategy",internal,,,,,
doc_021,QOF - Business Case.xlsx,xlsx,16002,,/Users/eduardolizana/Documents/6. Companies /1. Companies with Rodrigo/KeepMeCompany/4. Sales/8. QOF/QOF - Business Case.xlsx,4. Sales/8. QOF,triaged,yes,structured,no,"This document is an Excel spreadsheet listing NHS Quality and Outcomes Framework (QOF) codes relevant to GP practices. It details specific medical tasks, associated points, and performance thresholds, alongside internal notes on implementation strategies like phone-based reviews. The data outlines the metrics that KeepMeCompany's AI agents would likely help practices achieve to secure funding.","NHS,QOF,Healthcare Metrics,Sales,GP Practices",internal,,,,,
doc_022,QOF Results per Practice Summary.csv,csv,643144,,/Users/eduardolizana/Documents/6. Companies /1. Companies with Rodrigo/KeepMeCompany/4. Sales/8. QOF/QOF Results per Practice Summary.csv,4. Sales/8. QOF,triaged,no,structured,no,"This document is a CSV export of Quality and Outcomes Framework (QOF) performance metrics for various UK medical practices. It lists organization codes, practice names, addresses, postcodes, and annual performance scores from 2021 to 2024.","Sales,NHS,QOF,Target List,Healthcare Data",internal,,,,,
doc_023,QOF Results per Practice Summary.xlsx,xlsx,500453,,/Users/eduardolizana/Documents/6. Companies /1. Companies with Rodrigo/KeepMeCompany/4. Sales/8. QOF/QOF Results per Practice Summary.xlsx,4. Sales/8. QOF,triaged,no,structured,yes,This document is an Excel spreadsheet containing a list of UK medical practices and their Quality and Outcomes Framework (QOF) scores from 2021 to 2024. It includes contact details such as addresses and telephone numbers for each practice.,"QOF,Sales,GP Practices,UK Healthcare,Target List",internal,,,,,
doc_024,egpmemam(1).xlsx,xlsx,42509,,/Users/eduardolizana/Documents/6. Companies /1. Companies with Rodrigo/KeepMeCompany/4. Sales/1. Data/egpmemam(1).xlsx,4. Sales/1. Data,triaged,no,structured,yes,"This document is a raw Excel spreadsheet containing rows of alphanumeric identifiers, dates, and status flags. It appears to be a data export related to patient or practice records within the NHS context. The content lacks narrative context and consists entirely of structured data points.","raw_data,patient_records,nhs,sales_data,pii",internal,,,,,
doc_025,egpmemam.csv,csv,53486,,/Users/eduardolizana/Documents/6. Companies /1. Companies with Rodrigo/KeepMeCompany/4. Sales/1. Data/egpmemam.csv,4. Sales/1. Data,triaged,no,structured,yes,"This document is a raw CSV data export containing rows of alphanumeric IDs, record types, and date ranges spanning from 2019 to 2024. It appears to track individual records or memberships associated with the service, potentially representing patient or member engagement logs. The data lacks headers or narrative context, consisting solely of structured tabular values.","data-export,patient-records,sales-data,pii-sensitive,operational",internal,,,,,
doc_026,egpmemam.xlsx,xlsx,42509,,/Users/eduardolizana/Documents/6. Companies /1. Companies with Rodrigo/KeepMeCompany/4. Sales/1. Data/egpmemam.xlsx,4. Sales/1. Data,triaged,no,structured,yes,"This document is a raw Excel spreadsheet containing tabular data with alphanumeric identifiers, dates, and status flags. It appears to represent patient or customer records associated with GP practices, given the folder structure and data format. There is no narrative text or analysis included in the file.","raw-data,pii,sales-data,nhs,structured",internal,,,,,
doc_027,epraccur.csv,csv,3559562,,/Users/eduardolizana/Documents/6. Companies /1. Companies with Rodrigo/KeepMeCompany/4. Sales/1. Data/epraccur.csv,4. Sales/1. Data,triaged,no,structured,no,"This document is a CSV file containing a list of UK GP practices and medical centers with contact details. It includes practice names, addresses, postcodes, phone numbers, and internal classification codes. The data appears to be a sales prospect list or database of potential NHS practice clients.","sales_data,nhs_gps,contact_list,prospect_database,csv_export",internal,,,,,
doc_028,epraccur.xlsx,xlsx,1746449,,/Users/eduardolizana/Documents/6. Companies /1. Companies with Rodrigo/KeepMeCompany/4. Sales/1. Data/epraccur.xlsx,4. Sales/1. Data,triaged,no,structured,no,"This document is a raw Excel spreadsheet containing a structured list of UK GP medical practices and surgeries. It includes details such as practice names, addresses, postcodes, phone numbers, and various internal codes or status indicators. The data appears to be a sales target list or database export for the Cleveland and Stockton-on-Tees regions.","Sales Data,GP Practices,NHS Targets,Contact List,Raw Data",internal,,,,,
doc_029,gp-reg-pat-prac-all(1).xlsx,xlsx,303314,,/Users/eduardolizana/Documents/6. Companies /1. Companies with Rodrigo/KeepMeCompany/4. Sales/1. Data/gp-reg-pat-prac-all(1).xlsx,4. Sales/1. Data,triaged,no,structured,no,"This document is a raw Excel spreadsheet containing a dataset of UK GP practices and their patient counts. It lists practice codes, postcodes, ICB location codes, and total patient numbers extracted in November 2024. The data lacks narrative context and appears to be a sales target list or market registry.","Sales Data,GP Practices,NHS,Market Research,Raw Data",internal,,,,,
doc_030,gp-reg-pat-prac-all.csv,csv,469958,,/Users/eduardolizana/Documents/6. Companies /1. Companies with Rodrigo/KeepMeCompany/4. Sales/1. Data/gp-reg-pat-prac-all.csv,4. Sales/1. Data,triaged,no,structured,no,"This document is a CSV export listing UK GP practice locations, codes, and patient counts extracted in November 2024. It contains aggregated data such as postcodes and ICB location codes without individual patient details. The file appears to be raw sales data used for market targeting or operational analysis.","Sales Data,NHS,GP Practices,Raw Data,Market Analysis",internal,,,,,
doc_031,gp-reg-pat-prac-all.xlsx,xlsx,792731,,/Users/eduardolizana/Documents/6. Companies /1. Companies with Rodrigo/KeepMeCompany/4. Sales/1. Data/gp-reg-pat-prac-all.xlsx,4. Sales/1. Data,triaged,no,structured,no,"This document is a raw Excel spreadsheet containing a list of UK GP practices with associated metadata such as postcodes, location codes, and patient counts. It appears to be a sales target list or market data extract used for identifying potential medical practice clients. The content lacks narrative context or strategic analysis, consisting purely of tabular data rows.","sales_data,nhs,gp_practices,target_list,market_research",internal,,,,,
doc_032,2024_Practice_phone_access.csv,csv,1361292,,/Users/eduardolizana/Documents/6. Companies /1. Companies with Rodrigo/KeepMeCompany/4. Sales/0. Deprecated/2024_Practice_phone_access.csv,4. Sales/0. Deprecated,triaged,no,structured,no,This document is a deprecated CSV file containing a list of NHS GP practices in the North East and North Cumbria region. It includes practice identifiers alongside survey data measuring patient phone access difficulty percentages. The file appears to be raw market research data without narrative context regarding KeepMeCompany's specific usage or strategy.,"NHS,Sales Data,Market Research,Deprecated,GP Practices",internal,,,,,
doc_033,2024_Practice_phone_access.xlsx,xlsx,695841,,/Users/eduardolizana/Documents/6. Companies /1. Companies with Rodrigo/KeepMeCompany/4. Sales/0. Deprecated/2024_Practice_phone_access.xlsx,4. Sales/0. Deprecated,triaged,no,structured,no,"This document is a deprecated Excel spreadsheet listing UK GP practices and their Integrated Care System regions. It contains columns for practice identifiers and patient phone access difficulty percentages, though the majority of rows show zero values. Only a few entries at the bottom contain populated metrics regarding accessibility.","NHS,GP Practices,Market Data,Phone Access,Deprecated",internal,,,,,
doc_034,B1357-PCN-Adjusted-Populations-v1.3-updated-31-March.xlsx,xlsx,1096303,,/Users/eduardolizana/Documents/6. Companies /1. Companies with Rodrigo/KeepMeCompany/4. Sales/0. Deprecated/B1357-PCN-Adjusted-Populations-v1.3-updated-31-March.xlsx,4. Sales/0. Deprecated,triaged,no,structured,no,This Excel document outlines the methodology and dataset for Primary Care Network (PCN) adjusted populations as of January 2022. It explains NHS funding calculation formulas and lists specific PCNs with their population counts and regional codes.,"NHS,PCN,Sales,Data,Deprecated",internal,,,,,
doc_035,Copy of Brochure Clínicas Privadas España.pptx,pptx,1138347,,/Users/eduardolizana/Documents/6. Companies /1. Companies with Rodrigo/KeepMeCompany/4. Sales/0. Deprecated/Copy of Brochure Clínicas Privadas España.pptx,4. Sales/0. Deprecated,triaged,yes,structured,no,"This document is a Spanish-language sales brochure for KeepMeCompany's AI phone agent service, highlighting benefits like increased treatment adherence. It outlines the workflow of patient monitoring and provides contact details for Eduardo Lizana. The material is marked as deprecated and targets private clinics in Spain rather than the UK NHS.","Sales,Product Pitch,Healthcare AI,Spain Market,Deprecated",internal,,,,,
doc_036,GPPS_2024_ICS_data_(weighted)_(csv)_PUBLIC.xlsx,xlsx,12122,,/Users/eduardolizana/Documents/6. Companies /1. Companies with Rodrigo/KeepMeCompany/4. Sales/0. Deprecated/GPPS_2024_ICS_data_(weighted)_(csv)_PUBLIC.xlsx,4. Sales/0. Deprecated,triaged,no,structured,no,"This document is a deprecated Excel spreadsheet containing public NHS Integrated Care System (ICS) data from 2024. It lists regional codes, names, and weighted survey response metrics regarding patient experience or access difficulty across various UK commissioning regions.","NHS,Integrated Care Systems,Market Data,Deprecated,Healthcare Analytics",internal,,,,,
doc_037,GPPS_2024_National_data_(weighted)_(csv)_PUBLIC.xlsx,xlsx,26123,,/Users/eduardolizana/Documents/6. Companies /1. Companies with Rodrigo/KeepMeCompany/4. Sales/0. Deprecated/GPPS_2024_National_data_(weighted)_(csv)_PUBLIC.xlsx,4. Sales/0. Deprecated,triaged,no,structured,no,"This document is a spreadsheet containing the header row for a 2024 National GP Patient Survey dataset. It lists various metrics related to GP service usage channels such as phone, website, app, and reception, including counts and percentages. The file is marked as public data and stored in a deprecated sales folder.","NHS,Market Research,GP Patient Survey,Sales Data,Deprecated",internal,,,,,
doc_038,GPPS_2024_PCN_data_(weighted)_(csv)_PUBLIC.xlsx,xlsx,116014,,/Users/eduardolizana/Documents/6. Companies /1. Companies with Rodrigo/KeepMeCompany/4. Sales/0. Deprecated/GPPS_2024_PCN_data_(weighted)_(csv)_PUBLIC.xlsx,4. Sales/0. Deprecated,triaged,no,structured,no,"This document is a deprecated Excel spreadsheet containing a dataset of UK Primary Care Networks (PCNs) and their associated Integrated Care Systems (ICS). It lists specific PCN codes, names, commissioning regions, and various percentage-based metrics labeled as local GP services phone data. The data appears to be public-facing market information rather than internal company records.","NHS,PCN,Sales Data,Deprecated,Market Intelligence",internal,,,,,
doc_039,General-Practice-Database.xlsx,xlsx,88609,,/Users/eduardolizana/Documents/6. Companies /1. Companies with Rodrigo/KeepMeCompany/4. Sales/0. Deprecated/General-Practice-Database.xlsx,4. Sales/0. Deprecated,triaged,no,structured,no,"This document is a spreadsheet summary of a UK General Practice contact database containing aggregate statistics. It lists volumes of organizations, contact channels like emails and phone numbers, and breakdowns by region and practice size. The data appears to be a deprecated sales resource outlining the scope of the target market.","Sales Data,NHS GP Market,Contact Database,Deprecated,Market Sizing",internal,,,,,
