doc_id,filename,file_type,file_size,char_count,path,folder,status,include,content_type,sensitivity_flag,summary,topic_tags,audience,preprocessing_complete,extraction_quality,processed_char_count,chunking_complete,chunk_count
doc_148,Product - Monitor.xlsx,xlsx,1730896,,/Users/eduardolizana/Documents/6. Companies /1. Companies with Rodrigo/KeepMeCompany/3. Product/3. Product for Pilots /Product - Monitor.xlsx,3. Product/3. Product for Pilots ,triaged,maybe,structured,yes,"This Excel file contains product monitoring data and detailed conversation logs from AI phone agents. It includes performance metrics, patient PII (names, DOBs, phone numbers), and full transcripts of interactions with both patients and GP partners. The logs reveal the specific scripts and sales pitches used by the AI system.","AI Agents,Call Logs,PII,Product Metrics,Sales Scripts",technical,,,,,
doc_149,Product - Pilot Modules.xlsx,xlsx,237469,,/Users/eduardolizana/Documents/6. Companies /1. Companies with Rodrigo/KeepMeCompany/3. Product/3. Product for Pilots /Product - Pilot Modules.xlsx,3. Product/3. Product for Pilots ,triaged,yes,structured,yes,"This spreadsheet contains pilot data for the KeepMeCompany AI triage product, including patient demographics, call summaries, and technical performance metrics like latency and token usage. It outlines symptom urgency categories and monitoring logs for interactions, with some internal notes in Spanish regarding feature usage. The data includes specific patient names and health symptoms, indicating sensitive medical information.","Pilot Data,Triage System,Patient Records,AI Monitoring,Symptom Triage,NHS GP",internal,,,,,
doc_150,Product - Goals Architecture.xlsx,xlsx,55290,,/Users/eduardolizana/Documents/6. Companies /1. Companies with Rodrigo/KeepMeCompany/3. Product/10. Agents Prompts Refinement/Product - Goals Architecture.xlsx,3. Product/10. Agents Prompts Refinement,triaged,yes,structured,no,"This document outlines the logical architecture and decision flow for an AI agent designed to identify a user's favorite person through a series of clustered questions. It details a step-by-step methodology for handling macro-goals, adjusting micro-goals based on new information, and determining when to terminate a conversation path. The content uses a specific test scenario involving 'Rodrigo' to demonstrate how the agent navigates between general inquiries and specific family member clusters.","AI Agent Logic,Prompt Engineering,Product Architecture,Conversational Flow,Internal Development",technical,,,,,
doc_151,Product - Prompts Refinement.xlsx,xlsx,739035,,/Users/eduardolizana/Documents/6. Companies /1. Companies with Rodrigo/KeepMeCompany/3. Product/10. Agents Prompts Refinement/Product - Prompts Refinement.xlsx,3. Product/10. Agents Prompts Refinement,triaged,yes,structured,no,"This document is an Excel spreadsheet containing system prompts for the AI phone agents used in elderly care. It details the instructions for the Talker and Supervisor roles, defining conversation styles, objectives like learning names and hobbies, and logic for managing interaction flow.","AI Prompts,Product Development,Elderly Care,Conversation Design,Internal Documentation",technical,,,,,
doc_152,Testing Oct 22nd.docx,docx,290786,,/Users/eduardolizana/Documents/6. Companies /1. Companies with Rodrigo/KeepMeCompany/3. Product/2. Testing/Testing Oct 22nd.docx,3. Product/2. Testing,triaged,yes,structured,no,"This document contains internal QA testing logs for the AI phone agent, recording call IDs, durations, and specific performance issues. It highlights technical problems such as call loops, latency, transcription errors, and adherence to medical advice boundaries during simulated elderly care interactions. The notes provide direct feedback on user experience and system reliability from test sessions.","AI Testing,Product QA,Call Logs,Health Tech,System Performance",internal,,,,,
doc_153,Engineering - Nodes and Paths.xlsx,xlsx,7615,,/Users/eduardolizana/Documents/6. Companies /1. Companies with Rodrigo/KeepMeCompany/1. Engineering/Engineering - Nodes and Paths.xlsx,1. Engineering,triaged,yes,structured,no,"This document outlines the conversation flow architecture for the AI phone agent, detailing specific nodes for call reasons, emergency triage, and excluded use cases. It includes structured dialogue questions for assessing conditions like stroke, chest pain, and breathing difficulties, alongside fallback responses for unsupported scenarios. The data serves as the logical backbone for the medical triage capabilities of the KeepMeCompany system.","AI Agent Logic,Medical Triage,Conversation Flow,Engineering,Product Design",technical,,,,,
doc_154,Patients List - Production.xlsx,xlsx,224468,,/Users/eduardolizana/Documents/6. Companies /1. Companies with Rodrigo/KeepMeCompany/1. Engineering/Patients List - Production.xlsx,1. Engineering,triaged,no,structured,yes,"This document is an Excel spreadsheet containing a list of patient records with IDs, names, and dates of birth. Although the filename suggests production data, the sheet tab indicates it is a test sample with synthetic entries. The file is stored within the Engineering folder.","data,pii,engineering,testing,healthcare",technical,,,,,
doc_155,Cached Chunks - ElevenLabs Massive Call.xlsx,xlsx,1301550,,/Users/eduardolizana/Documents/6. Companies /1. Companies with Rodrigo/KeepMeCompany/1. Engineering/5. ElevenLabs Cached Messages/Cached Chunks - ElevenLabs Massive Call.xlsx,1. Engineering/5. ElevenLabs Cached Messages,triaged,yes,structured,yes,"This document is an Excel export of cached conversation chunks from the ElevenLabs AI phone agent system. It contains fragmented dialogue snippets in English, Spanish, and Italian, demonstrating symptom intake (e.g., headaches, pain ratings) and routing instructions to medical centers.","AI Agent Dialogue,Multilingual Support,Patient Intake,Engineering Logs,Healthcare Tech",technical,,,,,
doc_156,Inputs_Outputs.xlsx,xlsx,371220,,/Users/eduardolizana/Documents/6. Companies /1. Companies with Rodrigo/KeepMeCompany/1. Engineering/5. ElevenLabs Cached Messages/Inputs_Outputs.xlsx,1. Engineering/5. ElevenLabs Cached Messages,triaged,yes,structured,yes,"This document is an Excel spreadsheet containing system prompts and conversation logs for an AI voice agent. It details instructions for scheduling dental appointments in Spanish, including specific clinic addresses and operating hours.","prompt-engineering,voice-ai,conversation-logs,client-data,elevenlabs",technical,,,,,
doc_157,chunked_doctor_statements.csv,csv,266221,,/Users/eduardolizana/Documents/6. Companies /1. Companies with Rodrigo/KeepMeCompany/1. Engineering/5. ElevenLabs Cached Messages/chunked_doctor_statements.csv,1. Engineering/5. ElevenLabs Cached Messages,triaged,yes,structured,yes,"This document is a CSV file containing transcribed dialogue snippets from a medical consultation simulation. It includes patient history inquiries, symptom assessments, and medical advice typical of NHS GP triage interactions. The data appears to be cached messages from an ElevenLabs voice AI pipeline used for the startup's elderly care agents.","AI Voice Technology,Medical Dialogue,Patient Triage,Engineering Data,Healthcare AI",technical,,,,,
doc_158,chunked_doctor_statements.xlsx,xlsx,142516,,/Users/eduardolizana/Documents/6. Companies /1. Companies with Rodrigo/KeepMeCompany/1. Engineering/5. ElevenLabs Cached Messages/chunked_doctor_statements.xlsx,1. Engineering/5. ElevenLabs Cached Messages,triaged,no,structured,yes,"This document is an Excel spreadsheet containing raw dialogue chunks from AI-generated or transcribed medical consultations. It includes fragments of patient history questions, medical procedures, and conversational fillers typical of a doctor-patient interaction simulation.","AI-transcripts,medical-dialogue,engineering-data,ElevenLabs,raw-data",technical,,,,,
doc_159,Caché Messages Architecture.docx,docx,7422,,/Users/eduardolizana/Documents/6. Companies /1. Companies with Rodrigo/KeepMeCompany/1. Engineering/5. ElevenLabs Cached Messages/0. Deprecated/Caché Messages Architecture.docx,1. Engineering/5. ElevenLabs Cached Messages/0. Deprecated,triaged,yes,structured,no,This document outlines the deprecated architecture for caching AI voice responses within the KeepMeCompany backend system. It details strategies for fine-tuning filler words and implementing a TTS layer that prioritizes cached audio over generation to improve efficiency. The notes also describe a continuous improvement loop for comparing LLM responses and identifying deviations.,"AI Architecture,Voice Technology,Engineering,Caching,Deprecated",technical,,,,,
doc_160,Inputs_Outputs.csv,csv,6681488,,/Users/eduardolizana/Documents/6. Companies /1. Companies with Rodrigo/KeepMeCompany/1. Engineering/5. ElevenLabs Cached Messages/0. Deprecated/Inputs_Outputs.csv,1. Engineering/5. ElevenLabs Cached Messages/0. Deprecated,triaged,maybe,structured,yes,"This CSV file contains deprecated conversation logs and system prompts for an AI voice agent designed for patient interactions. It details instructions for prioritizing appointment scheduling goals and enforcing safety guardrails like avoiding medical advice, though the example scenario involves a Spanish dental clinic rather than UK NHS services.","AI-Prompts,Voice-Agents,Engineering,Deprecated,Safety-Guardrails",technical,,,,,
doc_161,Inputs_Outputs.xlsx,xlsx,246623,,/Users/eduardolizana/Documents/6. Companies /1. Companies with Rodrigo/KeepMeCompany/1. Engineering/5. ElevenLabs Cached Messages/0. Deprecated/Inputs_Outputs.xlsx,1. Engineering/5. ElevenLabs Cached Messages/0. Deprecated,triaged,yes,structured,no,"This document is a deprecated engineering spreadsheet containing system prompts and conversation logs for an AI voice agent. It outlines specific logic for appointment scheduling and user interaction constraints in Spanish, using a dental clinic scenario as an example.","prompt-engineering,voice-ai,engineering-data,conversation-flow,deprecated",technical,,,,,
doc_162,MTS-Dialog-TrainingSet.csv,csv,1041071,,/Users/eduardolizana/Documents/6. Companies /1. Companies with Rodrigo/KeepMeCompany/1. Engineering/5. ElevenLabs Cached Messages/0. Deprecated/MTS-Dialog-TrainingSet.csv,1. Engineering/5. ElevenLabs Cached Messages/0. Deprecated,triaged,no,structured,yes,"This document is a CSV file containing a deprecated training dataset for medical dialogue interactions. It includes structured patient history summaries paired with simulated doctor-patient conversations covering various conditions like hypertension, migraines, and medication inquiries. The data appears to be cached messages from ElevenLabs intended for voice AI training purposes.","Medical Dialogue,Training Data,AI Engineering,Deprecated,Healthcare",technical,,,,,
doc_163,MTS-Dialog-TrainingSet.xlsx,xlsx,354120,,/Users/eduardolizana/Documents/6. Companies /1. Companies with Rodrigo/KeepMeCompany/1. Engineering/5. ElevenLabs Cached Messages/0. Deprecated/MTS-Dialog-TrainingSet.xlsx,1. Engineering/5. ElevenLabs Cached Messages/0. Deprecated,triaged,no,structured,yes,This document is a deprecated Excel spreadsheet containing a training dataset for medical dialogue interactions. It includes structured columns with patient history summaries and simulated doctor-patient conversations covering various conditions. The data appears to be cached messages from ElevenLabs used for engineering purposes.,"AI-training-data,ElevenLabs,medical-dialogues,deprecated,health-tech",technical,,,,,
doc_164,bquxjob_26e8f420_195040c9f18 (1).csv,csv,6154128,,/Users/eduardolizana/Documents/6. Companies /1. Companies with Rodrigo/KeepMeCompany/1. Engineering/5. ElevenLabs Cached Messages/0. Deprecated/bquxjob_26e8f420_195040c9f18 (1).csv,1. Engineering/5. ElevenLabs Cached Messages/0. Deprecated,triaged,yes,structured,yes,"This CSV file contains system prompts and conversation history for an AI voice agent designed for a dental clinic in Chile. The instructions define goal prioritization, safety guardrails regarding medical advice, and specific business details like clinic location and availability. The content is written in Spanish and appears to be a deprecated engineering artifact.","AI-Prompting,Voice-Agent,Healthcare-Tech,Spanish-Language,Engineering-Artifacts",technical,,,,,
doc_165,chunked_conversations.csv,csv,135783,,/Users/eduardolizana/Documents/6. Companies /1. Companies with Rodrigo/KeepMeCompany/1. Engineering/5. ElevenLabs Cached Messages/0. Deprecated/chunked_conversations.csv,1. Engineering/5. ElevenLabs Cached Messages/0. Deprecated,triaged,maybe,structured,yes,"This CSV file contains conversation chunks from a deprecated ElevenLabs cache, simulating patient interactions with an AI triage agent. It includes symptom descriptions, pain ratings, and standard medical intake questions in multiple languages.","AI Triage,Conversation Data,Deprecated,Health Tech,ElevenLabs",technical,,,,,
doc_166,chunked_syntethic.csv,csv,405499,,/Users/eduardolizana/Documents/6. Companies /1. Companies with Rodrigo/KeepMeCompany/1. Engineering/5. ElevenLabs Cached Messages/0. Deprecated/chunked_syntethic.csv,1. Engineering/5. ElevenLabs Cached Messages/0. Deprecated,triaged,yes,structured,yes,"This document is a deprecated CSV file containing synthetic dialogue chunks from an AI phone agent designed for NHS GP practices. It includes sample conversational turns where the agent asks about symptoms, offers follow-ups, and references GDPR compliance. The data appears to be cached messages from an ElevenLabs integration used for testing or training the voice agent.","AI Voice Agent,NHS GP,GDPR Compliance,Synthetic Data,ElevenLabs",technical,,,,,
doc_167,chunked_syntethic.xlsx,xlsx,151040,,/Users/eduardolizana/Documents/6. Companies /1. Companies with Rodrigo/KeepMeCompany/1. Engineering/5. ElevenLabs Cached Messages/0. Deprecated/chunked_syntethic.xlsx,1. Engineering/5. ElevenLabs Cached Messages/0. Deprecated,triaged,maybe,structured,yes,"This document is a deprecated Excel file containing cached dialogue chunks from an ElevenLabs AI voice agent integration. It lists various patient intake questions and conversational fragments in English, Spanish, and French, alongside internal technical tags related to medical follow-ups and data organization.","AI Voice Agents,Patient Intake,ElevenLabs,Deprecated Data,GDPR",technical,,,,,
doc_168,External Services - Cost Mapping - Vendors.xlsx,xlsx,31559,,/Users/eduardolizana/Documents/6. Companies /1. Companies with Rodrigo/KeepMeCompany/1. Engineering/4. External Services/External Services - Cost Mapping - Vendors.xlsx,1. Engineering/4. External Services,triaged,yes,structured,yes,"This document is a spreadsheet mapping external service vendors and their associated costs for the company's engineering infrastructure. It details pricing tiers, usage quotas, and specific service names for providers such as Twilio, OpenAI, Heroku, and Firebase. The data includes estimated costs per minute or month and links to vendor documentation.","Engineering,Vendor Management,Cost Analysis,Tech Stack",internal,,,,,
doc_169,Fine Tuning - goalsTracker.xlsx,xlsx,584764,,/Users/eduardolizana/Documents/6. Companies /1. Companies with Rodrigo/KeepMeCompany/1. Engineering/2. Fine-Tuning Jobs/Fine Tuning - goalsTracker.xlsx,1. Engineering/2. Fine-Tuning Jobs,triaged,no,structured,no,"This Excel file contains structured training data used for AI fine-tuning jobs. It lists conversation scenarios involving retail, event planning, and general assistance, tracking user messages and model responses against specific goals. The content does not reflect the company's actual healthcare or NHS focus.","fine-tuning,training-data,engineering,ai-models,customer-service",technical,,,,,
doc_170,Fine Tuning - Talker Cleaned Data.xlsx,xlsx,3302003,,/Users/eduardolizana/Documents/6. Companies /1. Companies with Rodrigo/KeepMeCompany/1. Engineering/2. Fine-Tuning Jobs/1. Talker/Fine Tuning - Talker Cleaned Data.xlsx,1. Engineering/2. Fine-Tuning Jobs/1. Talker,triaged,yes,structured,yes,"This Excel file contains cleaned training data for the KeepMeCompany Talker AI agent fine-tuning process. It details conversation archetypes, including goals, history, inputs, and outputs with explanations of the AI's decision logic. The data illustrates how the agent handles user interactions like subscription checks and goal transitions.","AI Fine-Tuning,Product Logic,Engineering Data,Conversation Design,Talker Agent",technical,,,,,
doc_171,Fine Tuning - Talker Oct 6th - Outputs.xlsx,xlsx,373424,,/Users/eduardolizana/Documents/6. Companies /1. Companies with Rodrigo/KeepMeCompany/1. Engineering/2. Fine-Tuning Jobs/1. Talker/Fine Tuning - Talker Oct 6th - Outputs.xlsx,1. Engineering/2. Fine-Tuning Jobs/1. Talker,triaged,yes,structured,yes,"This Excel file contains training data and logic definitions for the Talker AI agent's fine-tuning process. It outlines specific conversation archetypes, goals, and prompt structures used to guide the AI's responses to user queries. The document details how the model transitions between goals and handles subscription-related interactions.","AI Fine-Tuning,Conversation Archetypes,Engineering,Product Logic",technical,,,,,
doc_172,Fine Tuning - Talker Oct 6th.xlsx,xlsx,84107,,/Users/eduardolizana/Documents/6. Companies /1. Companies with Rodrigo/KeepMeCompany/1. Engineering/2. Fine-Tuning Jobs/1. Talker/Fine Tuning - Talker Oct 6th.xlsx,1. Engineering/2. Fine-Tuning Jobs/1. Talker,triaged,yes,structured,no,"This document is an Excel spreadsheet detailing logic scenarios for fine-tuning the 'Talker' AI agent. It defines conversation archetypes, such as prioritizing direct questions versus primary goals, complete with example inputs, outputs, and explanations for training validation. The data represents internal engineering specifications for prompt behavior and model logic.","AI Fine-Tuning,Prompt Engineering,Conversation Logic,Engineering Documentation,Talker Agent",technical,,,,,
doc_173,Fine Tuning Talker - Raw_Data.xlsx,xlsx,18811,,/Users/eduardolizana/Documents/6. Companies /1. Companies with Rodrigo/KeepMeCompany/1. Engineering/2. Fine-Tuning Jobs/1. Talker/Fine Tuning Talker - Raw_Data.xlsx,1. Engineering/2. Fine-Tuning Jobs/1. Talker,triaged,yes,structured,no,"This document outlines specific AI conversation archetypes used for fine-tuning the 'Talker' agent, including rules for answering questions and managing goals. It provides structured examples and explanations for behaviors like addressing primary goals or breaking down complex tasks. The content serves as technical documentation for the engineering team regarding the AI's interaction logic.","AI Fine-Tuning,Engineering,Prompt Engineering,Agent Behavior,Product Logic",technical,,,,,
doc_174,output.csv,csv,345536,,/Users/eduardolizana/Documents/6. Companies /1. Companies with Rodrigo/KeepMeCompany/1. Engineering/2. Fine-Tuning Jobs/1. Talker/output.csv,1. Engineering/2. Fine-Tuning Jobs/1. Talker,triaged,yes,structured,no,"This CSV file contains fine-tuning training data for an AI conversation model, specifically defining the ""Answer Direct Question"" logic archetype. It provides structured scenarios involving students, tourists, and patients to illustrate how the AI should prioritize direct user inquiries before addressing broader goals. The data serves as a guideline for engineering the conversational behavior of the startup's AI agents.","AI Fine-Tuning,Conversation Logic,Training Data,Healthcare Scenarios,Engineering",technical,,,,,
doc_175,output.xlsx,xlsx,93820,,/Users/eduardolizana/Documents/6. Companies /1. Companies with Rodrigo/KeepMeCompany/1. Engineering/2. Fine-Tuning Jobs/1. Talker/output.xlsx,1. Engineering/2. Fine-Tuning Jobs/1. Talker,triaged,yes,structured,no,"This document is an Excel sheet detailing logic archetypes for fine-tuning AI conversational agents. It utilizes a fictional wedding planner scenario to demonstrate how the system prioritizes direct user questions, primary goals, and transitions between objectives. The content outlines specific interaction flows and assistant goals intended to guide the AI's response behavior.","AI Architecture,Fine-Tuning,Conversational Logic,Engineering,Prompt Engineering",technical,,,,,
doc_176,Engineering - Sandbox Example.xlsx,xlsx,373605,,/Users/eduardolizana/Documents/6. Companies /1. Companies with Rodrigo/KeepMeCompany/1. Engineering/0. Deprecated/Engineering - Sandbox Example.xlsx,1. Engineering/0. Deprecated,triaged,yes,structured,no,"This document is a deprecated engineering spreadsheet outlining the prompt architecture for KeepMeCompany's AI agent system. It defines specific roles for the Talker, Supervisor, and Goalstracker agents, including their objectives and decision-making logic for interacting with elderly users. The content serves as a sandbox example for testing conversation flows and goal management within the health-tech application.","AI Agents,Prompt Engineering,Elderly Care,Deprecated,System Architecture",technical,,,,,
doc_177,Engineering - Verify Patients.docx,docx,10872,,/Users/eduardolizana/Documents/6. Companies /1. Companies with Rodrigo/KeepMeCompany/1. Engineering/1. Patient Verification/Engineering - Verify Patients.docx,1. Engineering/1. Patient Verification,triaged,yes,prose,yes,"This document outlines technical strategies for verifying patient identities within an AI-powered voice agent system. It details methods to mitigate speech-to-text errors, such as phonetic matching and custom vocabularies, while leveraging NHS IDs and phone numbers for confirmation. The notes also highlight specific examples of transcription failures with diverse names and multilingual considerations.","Patient Verification,Speech-to-Text,AI Engineering,NHS Integration,Data Privacy",technical,,,,,
doc_178,Patient Verification - Examples and Cached Responses.xlsx,xlsx,435043,,/Users/eduardolizana/Documents/6. Companies /1. Companies with Rodrigo/KeepMeCompany/1. Engineering/1. Patient Verification/Patient Verification - Examples and Cached Responses.xlsx,1. Engineering/1. Patient Verification,triaged,no,structured,yes,"This document is an Excel spreadsheet containing a test dataset of patient records used for engineering verification purposes. It lists 46 entries with identifiers, full names, dates of birth, and refiner codes, primarily consisting of common names and some celebrity references. The data appears to be synthetic test data rather than actual patient records.","Patient Verification,Test Data,Engineering,PII,Health-Tech",technical,,,,,
doc_179,Patient Verification - Prompts.docx,docx,6386,,/Users/eduardolizana/Documents/6. Companies /1. Companies with Rodrigo/KeepMeCompany/1. Engineering/1. Patient Verification/Patient Verification - Prompts.docx,1. Engineering/1. Patient Verification,excluded-bad-extraction,no,,,File could not be read (empty or unsupported format),,,,,,,
doc_180,Agents Sandbox.xlsx,xlsx,362735,,/Users/eduardolizana/Documents/6. Companies /1. Companies with Rodrigo/KeepMeCompany/1. Engineering/3. Sandbox/Agents Sandbox.xlsx,1. Engineering/3. Sandbox,triaged,maybe,structured,yes,"This Excel file contains engineering sandbox logs of AI agent interactions, detailing conversation histories, goal tracking metrics, and raw outputs. It includes test cases for medical symptom inquiries alongside unrelated scenarios like restaurant reservations. The data reveals internal system components such as the Talker and Goals Tracker modules.","AI Agent Testing,Conversation Logs,Engineering Sandbox,Goal Tracking,Healthcare AI",technical,,,,,
doc_181,Untitled spreadsheet.xlsx,xlsx,9349,,/Users/eduardolizana/Documents/6. Companies /1. Companies with Rodrigo/KeepMeCompany/1. Engineering/6. Vectorization Caches/Untitled spreadsheet.xlsx,1. Engineering/6. Vectorization Caches,triaged,no,structured,yes,"This document is a raw spreadsheet containing Twilio call logs and patient conversation data. It includes personally identifiable information such as patient names, dates of birth, and phone numbers, along with links to audio recordings and summaries.","call-logs,pii,engineering-data,twilio,dental-clinic",technical,,,,,
doc_182,Employees - Stock Value Calculator.xlsx,xlsx,53467,,/Users/eduardolizana/Documents/6. Companies /1. Companies with Rodrigo/KeepMeCompany/7. Administratives/9. Team/Employees - Stock Value Calculator.xlsx,7. Administratives/9. Team,triaged,no,structured,yes,"This Excel file is an internal template titled 'Employees - Stock Value Calculator' used to project employee stock value based on company growth. It outlines a five-year company valuation trajectory from 5 million to 1 billion, with corresponding stock values ranging from 25,000 to 5 million. The document contains no specific employee names or actual performance data, only the calculation framework.","equity,financial projections,employee compensation,internal tools,valuation",internal,,,,,
doc_183,Good Employee _ Bad Employee.docx,docx,7488,,/Users/eduardolizana/Documents/6. Companies /1. Companies with Rodrigo/KeepMeCompany/7. Administratives/9. Team/Good Employee _ Bad Employee.docx,7. Administratives/9. Team,triaged,yes,prose,no,"This document outlines the behavioral expectations and cultural values for employees within the organization. It contrasts 'good' versus 'bad' employee traits, emphasizing ownership, accountability, communication, and dedication to the company's success. The text serves as a guide for internal team alignment and performance standards.","Company Culture,Employee Expectations,Internal Guidelines,Team Values,Work Ethic",internal,,,,,
