doc_id,filename,file_type,file_size,char_count,path,folder,status,include,content_type,sensitivity_flag,summary,topic_tags,audience,preprocessing_complete,extraction_quality,processed_char_count,chunking_complete,chunk_count
doc_247,Firebase Data Processing and Security Terms.pdf,pdf,381882,,/Users/eduardolizana/Documents/6. Companies /1. Companies with Rodrigo/KeepMeCompany/7. Administratives/2. UK Regulations/3. GDPR/1. DPAs/Firebase Data Processing and Security Terms.pdf,7. Administratives/2. UK Regulations/3. GDPR/1. DPAs,triaged,yes,structured,yes,"This document details the Firebase Data Processing and Security Terms agreed upon between the Customer and Google LLC. It establishes definitions and obligations regarding data processing, security controls, and adherence to UK GDPR, EU GDPR, and Swiss FDPA regulations. The text serves as a legal framework for handling Customer Data and Personal Data within the Firebase Services.","GDPR,Data Privacy,Firebase,Legal Compliance,UK Regulations",internal,,,,,
doc_248,data-processing-addendum (Salesforce_Heroku).pdf,pdf,913508,,/Users/eduardolizana/Documents/6. Companies /1. Companies with Rodrigo/KeepMeCompany/7. Administratives/2. UK Regulations/3. GDPR/1. DPAs/data-processing-addendum (Salesforce_Heroku).pdf,7. Administratives/2. UK Regulations/3. GDPR/1. DPAs,triaged,yes,structured,yes,"This document is a Salesforce Data Processing Addendum (DPA) dated November 2023, serving as a legal contract for data processing compliance. It defines terms for handling personal data between Salesforce and the customer to align with GDPR and UK regulations. The text outlines execution procedures, definitions of data roles, and references to Standard Contractual Clauses.","GDPR,Data Privacy,Legal Compliance,Salesforce,UK Regulations",internal,,,,,
doc_249,CE Mark - Steps.docx,docx,8667,,/Users/eduardolizana/Documents/6. Companies /1. Companies with Rodrigo/KeepMeCompany/7. Administratives/2. UK Regulations/4. Medical Device Regulations/CE Mark - Steps.docx,7. Administratives/2. UK Regulations/4. Medical Device Regulations,triaged,yes,structured,yes,"This document outlines the step-by-step regulatory process for obtaining CE Mark certification for a medical device, covering QMS implementation, risk management, and clinical evaluation. It provides specific cost estimates in multiple currencies for consultancy, Notified Body fees, and MHRA registration, alongside internal questions about UKCA approval and clinical evaluation methods. The file also references a previous entity named 'FormerlyAI', indicating a potential company history or pivot.","Medical Device Regulations,CE Mark,Compliance Costs,Regulatory Strategy,UKCA",internal,,,,,
doc_250,Medical Device - Regulation Paths.docx,docx,11495,,/Users/eduardolizana/Documents/6. Companies /1. Companies with Rodrigo/KeepMeCompany/7. Administratives/2. UK Regulations/4. Medical Device Regulations/Medical Device - Regulation Paths.docx,7. Administratives/2. UK Regulations/4. Medical Device Regulations,triaged,yes,mixed,yes,"This document details regulatory pathways for UKCA and CE marking for medical devices, outlining costs and timelines for Class I and Class IIa classifications. It includes internal strategic notes regarding the company's LLM-based product classification and compliance with MDCG Software as a Medical Device guidelines. The content covers QMS requirements, clinical evaluation steps, and specific product context regarding triage and GP responsibility.","Regulatory Compliance,Medical Device Regulations,Cost Estimation,SaMD,UKCA/CE Marking",internal,,,,,
doc_251,Medical Device Regulations - Intended Use.docx,docx,11675,,/Users/eduardolizana/Documents/6. Companies /1. Companies with Rodrigo/KeepMeCompany/7. Administratives/2. UK Regulations/4. Medical Device Regulations/Medical Device Regulations - Intended Use.docx,7. Administratives/2. UK Regulations/4. Medical Device Regulations,triaged,yes,mixed,yes,"This document outlines the intended use and regulatory classification strategy for KeepMeCompany's AI-powered phone agent serving NHS GP practices. It details the product workflow, including patient verification and triaging, while comparing the service against competitors like eConsult and Ada Health regarding medical device risk classes. Finally, it provides a draft statement for Medical Device Regulation compliance defining the device's purpose and limitations.","Medical Device Regulation,Product Workflow,Competitor Analysis,NHS Integration,AI Compliance",internal,,,,,
doc_252,Privacy Policy - Sept 2024.docx,docx,10104,,/Users/eduardolizana/Documents/6. Companies /1. Companies with Rodrigo/KeepMeCompany/7. Administratives/2. UK Regulations/0. Privacy Policy/Privacy Policy - Sept 2024.docx,7. Administratives/2. UK Regulations/0. Privacy Policy,triaged,yes,mixed,yes,"This document outlines KeepMeCompany's September 2024 privacy policy, detailing the collection, usage, and security of personal and health information for their AI phone agent services. It specifies compliance with GDPR regulations, data retention practices involving automatic deletion after GP consultation, and outlines user rights regarding data access and erasure. Contact details for the Data Controller and Data Protection Officer are included alongside supervisory authority information.","Privacy Policy,GDPR Compliance,Health Data Handling,Legal Documentation,Data Security",internal,,,,,
doc_253,Information for Visas.docx,docx,6438,,/Users/eduardolizana/Documents/6. Companies /1. Companies with Rodrigo/KeepMeCompany/7. Administratives/1. Visas/Information for Visas.docx,7. Administratives/1. Visas,triaged,no,structured,yes,This document appears to be a minimal template or draft form for collecting visa and passport information for an individual named Eduardo. It contains a name field and a blank passport entry but lacks any substantive narrative or completed data. It serves as an administrative record rather than operational documentation.,"HR,Visas,Administrative,PII,Templates",internal,,,,,
doc_254,Endorsement UKES - Answers.docx,docx,19722,,/Users/eduardolizana/Documents/6. Companies /1. Companies with Rodrigo/KeepMeCompany/7. Administratives/1. Visas/Endorsers - UKES/Endorsement UKES - Answers.docx,7. Administratives/1. Visas/Endorsers - UKES,triaged,yes,mixed,no,"This document is a Q&A response to an Innovate UK Endorsed (UKES) visa application addressing questions on IP, technology novelty, and team innovation. It highlights the platform's current deployment in Latin America and alignment with UK economic priorities while referencing academic studies on AI companionship. Several sections contain incomplete text placeholders, indicating the document was not fully finalized.","Innovate UK,Visa Application,AI Companion,TRL Readiness,Product Strategy",internal,,,,,
doc_255,KeepMeCompany - Financial Forecast.xlsx,xlsx,640806,,/Users/eduardolizana/Documents/6. Companies /1. Companies with Rodrigo/KeepMeCompany/7. Administratives/1. Visas/Endorsers - UKES/KeepMeCompany - Financial Forecast.xlsx,7. Administratives/1. Visas/Endorsers - UKES,triaged,yes,structured,yes,"This document presents a three-year financial forecast for KeepMeCompany, outlining projected revenue, operating expenses, and EBITDA in GBP. It details specific hiring plans for executive and engineering roles alongside assumptions for VAT and tax compliance. The file appears to be part of a visa endorsement package, given its placement in the Administratives/Visas folder.","Financial Forecast,Business Plan,UK Visa,Revenue Model,Hiring Plan",investors,,,,,
doc_256,UKES - Business Plan.docx,docx,739563,,/Users/eduardolizana/Documents/6. Companies /1. Companies with Rodrigo/KeepMeCompany/7. Administratives/1. Visas/Endorsers - UKES/UKES - Business Plan.docx,7. Administratives/1. Visas/Endorsers - UKES,triaged,yes,prose,yes,"This document is a business plan prepared for the UK Endorsed Body Scheme (UKES) visa application. It details the KeepMeCompany AI companion product for seniors, currently in beta with 8 users, outlining market potential and financial projections for the first three years. The text specifically addresses the Innovation, Viability, and Scalability criteria required for visa endorsement.","Business Plan,UKES Visa,AI Health Tech,Financial Projections,Senior Care",investors,,,,,
doc_257,UKES - Business Plan.pdf,pdf,102316,,/Users/eduardolizana/Documents/6. Companies /1. Companies with Rodrigo/KeepMeCompany/7. Administratives/1. Visas/Endorsers - UKES/UKES - Business Plan.pdf,7. Administratives/1. Visas/Endorsers - UKES,triaged,yes,mixed,yes,"This document is a business plan excerpt intended for a UK Endorser Scheme visa application, detailing KeepMeCompany's AI companion product for elderly care. It outlines the problem of senior isolation, the proposed AI solution, market potential, and aggressive financial projections aiming for $14.4 million revenue by year three. The text also covers the team's background and the scalability of the software-only solution.","Business Plan,AI Healthcare,Financial Projections,UK Visa,Product Strategy",internal,,,,,
doc_258,Selfie with Passport.pdf,pdf,1542833,,/Users/eduardolizana/Documents/6. Companies /1. Companies with Rodrigo/KeepMeCompany/7. Administratives/1. Visas/Endorsers - UKES/Required Documents/Selfie with Passport.pdf,7. Administratives/1. Visas/Endorsers - UKES/Required Documents,excluded-bad-extraction,no,,,File could not be read (empty or unsupported format),,,,,,,
doc_259,council tax.pdf,pdf,1479792,,/Users/eduardolizana/Documents/6. Companies /1. Companies with Rodrigo/KeepMeCompany/7. Administratives/1. Visas/Endorsers - UKES/Required Documents/council tax.pdf,7. Administratives/1. Visas/Endorsers - UKES/Required Documents,excluded-bad-extraction,no,,,File could not be read (empty or unsupported format),,,,,,,
doc_260,national id.pdf,pdf,4838835,,/Users/eduardolizana/Documents/6. Companies /1. Companies with Rodrigo/KeepMeCompany/7. Administratives/1. Visas/Endorsers - UKES/Required Documents/national id.pdf,7. Administratives/1. Visas/Endorsers - UKES/Required Documents,excluded-bad-extraction,no,,,File could not be read (empty or unsupported format),,,,,,,
doc_261,spanish passport.pdf,pdf,2079702,,/Users/eduardolizana/Documents/6. Companies /1. Companies with Rodrigo/KeepMeCompany/7. Administratives/1. Visas/Endorsers - UKES/Required Documents/spanish passport.pdf,7. Administratives/1. Visas/Endorsers - UKES/Required Documents,excluded-bad-extraction,no,,,File could not be read (empty or unsupported format),,,,,,,
doc_262,CV - Rodrigo Orpis.docx,docx,198623,,/Users/eduardolizana/Documents/6. Companies /1. Companies with Rodrigo/KeepMeCompany/7. Administratives/1. Visas/Endorsers - UKES/CVs/CV - Rodrigo Orpis.docx,7. Administratives/1. Visas/Endorsers - UKES/CVs,excluded-privacy,no,structured,yes,"This document is a Curriculum Vitae for Rodrigo Orpis, detailing his professional experience at companies like Deliveroo, Beacon, and Cornershop, along with his education and technical skills. It is located in an administrative folder related to UK Visa Endorsers, suggesting it supports immigration or sponsorship documentation for the startup. The CV highlights his background in operations strategy, data analysis, and optimization.","Human Resources,Visa Sponsorship,Employee Profile,Operations Strategy,PII",internal,,,,,
doc_263,CV - Rodrigo Orpis.pdf,pdf,86454,,/Users/eduardolizana/Documents/6. Companies /1. Companies with Rodrigo/KeepMeCompany/7. Administratives/1. Visas/Endorsers - UKES/CVs/CV - Rodrigo Orpis.pdf,7. Administratives/1. Visas/Endorsers - UKES/CVs,excluded-privacy,no,mixed,yes,"This document is a professional CV for Rodrigo Orpis, detailing his work history at companies like Deliveroo, Beacon, and Cornershop, along with his education and technical skills. It outlines his experience in strategy, operations, and data analysis within the UK and Chile. The file is stored in an administrative folder related to UK visa endorsements.","Team Background,Visa Documentation,Operations Strategy,Personal Data,Recruitment",internal,,,,,
doc_264,Eduardo Lizana Resume.docx.pdf,pdf,124202,,/Users/eduardolizana/Documents/6. Companies /1. Companies with Rodrigo/KeepMeCompany/7. Administratives/1. Visas/Endorsers - UKES/CVs/Eduardo Lizana Resume.docx.pdf,7. Administratives/1. Visas/Endorsers - UKES/CVs,excluded-privacy,no,structured,yes,"This document is a professional resume for Eduardo Lizana, detailing his current role as UK/EU CEO at KeepMeCompany and his extensive prior experience in tech delivery and strategy at companies like Yango and Uber. It includes specific operational metrics and financial achievements from his previous tenures, such as EBITDA improvements and margin optimizations.","CEO,Founder Background,Operations,KeepMeCompany,Resume",internal,,,,,
doc_265,Edu - Checklist Visa España.xlsx,xlsx,51995,,/Users/eduardolizana/Documents/6. Companies /1. Companies with Rodrigo/KeepMeCompany/7. Administratives/1. Visas/1. Visa Edu/Edu - Checklist Visa España.xlsx,7. Administratives/1. Visas/1. Visa Edu,triaged,no,structured,yes,"This document is an Excel checklist outlining the step-by-step process for obtaining a Spanish Foreigner Identity Card (TIE). It details requirements such as municipal registration, fee payments, and appointment bookings, referencing specific forms and a contact named Rodrigo.","Visa,Immigration,Spain,Administrative,Personal",personal,,,,,
doc_266,RECURSO POTESTATIVO DE REPOSICIÓN - Visado España 19 Nov.docx,docx,9792,,/Users/eduardolizana/Documents/6. Companies /1. Companies with Rodrigo/KeepMeCompany/7. Administratives/1. Visas/1. Visa Edu/RECURSO POTESTATIVO DE REPOSICIÓN - Visado España 19 Nov.docx,7. Administratives/1. Visas/1. Visa Edu,triaged,no,structured,yes,"This document is a formal legal appeal submitted by Eduardo Antonio Lizana Yaksic to the Spanish General Consul in Santiago de Chile regarding a denied non-lucrative residence visa. It details financial evidence, including income from Yango and Uber, and medical certification to justify economic solvency. The document includes personal identifiers such as passport numbers and specific bank account details.","visa_application,legal_appeal,personal_data,immigration,financial_proof",personal,,,,,
doc_267,NOTES.docx,docx,6634,,/Users/eduardolizana/Documents/6. Companies /1. Companies with Rodrigo/KeepMeCompany/7. Administratives/3. QMS Documentation/NOTES.docx,7. Administratives/3. QMS Documentation,triaged,no,structured,no,This document appears to be a fragment or placeholder within the Quality Management System (QMS) folder. It contains a brief status note indicating that post-market items are pending and references a specific field labeled SRN. The content lacks narrative context or detailed information regarding the startup's operations.,"QMS,Post-Market Surveillance,Administrative,Status Update,Medical Device Compliance",internal,,,,,
doc_268,Device label.docx,docx,47604,,/Users/eduardolizana/Documents/6. Companies /1. Companies with Rodrigo/KeepMeCompany/7. Administratives/3. QMS Documentation/1. Released Documents/6. Misc./Device label.docx,7. Administratives/3. QMS Documentation/1. Released Documents/6. Misc.,triaged,yes,structured,yes,This document serves as a regulatory device label for the 'AI Doctor & Patient Consultation Platform' software release. It confirms the product is classified as a Class I medical device under EU MDR 2017/745 and lists the company's London address and software version 1.0. The document includes unique identifiers and release dates but refers users to external instructions for warnings.,"Regulatory Compliance,Medical Device,Product Release,EU MDR,QMS",internal,,,,,
doc_269,Technical File.docx,docx,71986,,/Users/eduardolizana/Documents/6. Companies /1. Companies with Rodrigo/KeepMeCompany/7. Administratives/3. QMS Documentation/1. Released Documents/6. Misc./Technical File.docx,7. Administratives/3. QMS Documentation/1. Released Documents/6. Misc.,triaged,yes,structured,yes,"This document serves as the Technical File for KeepMeCompany's AI Doctor & Patient Consultation Platform, detailing its function as an AI-driven phone system for UK GP practices. It specifies the operational workflow, intended user population, and regulatory classification as a Class I medical device under EU MDR 2017/745. The file also lists unique device identifiers and references associated clinical evaluation reports.","Medical Device Regulation,Product Specification,AI Telephony,Compliance,GP Practice Workflow",technical,,,,,
doc_270,UDI Details.docx,docx,7813,,/Users/eduardolizana/Documents/6. Companies /1. Companies with Rodrigo/KeepMeCompany/7. Administratives/3. QMS Documentation/1. Released Documents/6. Misc./UDI Details.docx,7. Administratives/3. QMS Documentation/1. Released Documents/6. Misc.,triaged,yes,structured,no,"This document records the Unique Device Identifier (UDI) details for a medical device software product registered with UK authorities. It specifies the Device Identifier, Production Identifier, and Single Registration Number (SRN) alongside the European Medical Device Nomenclature code. The document also includes placeholders for signatures and revision history.","Regulatory Compliance,Medical Device Software,UDI,QMS,UK MHRA",internal,,,,,
doc_271,"EU Declaration of Conformity - 1_13_25, 12_56 PM.pdf",pdf,146570,,"/Users/eduardolizana/Documents/6. Companies /1. Companies with Rodrigo/KeepMeCompany/7. Administratives/3. QMS Documentation/1. Released Documents/2. Product/EU Declaration of Conformity - 1_13_25, 12_56 PM.pdf",7. Administratives/3. QMS Documentation/1. Released Documents/2. Product,triaged,yes,mixed,yes,"This document is an EU Declaration of Conformity certifying KeepMeCompany's AI Doctor & Patient Consultation Platform as a Class I medical device under MDR 2017/745. It details the regulatory justification for the classification, lists applicable technical standards, and includes signature details from the CEO and regulatory contacts. The document confirms the software functions solely as a communication tool without diagnostic decision-making capabilities.","Regulatory Compliance,Medical Device Regulation,Quality Management System,Product Classification,Legal Documentation",internal,,,,,
doc_272,EU Declaration of Conformity.docx,docx,12026,,/Users/eduardolizana/Documents/6. Companies /1. Companies with Rodrigo/KeepMeCompany/7. Administratives/3. QMS Documentation/1. Released Documents/2. Product/EU Declaration of Conformity.docx,7. Administratives/3. QMS Documentation/1. Released Documents/2. Product,triaged,yes,mixed,yes,"This document is a formal EU Declaration of Conformity issued by KeepMeCompany Ltd for its AI Doctor & Patient Consultation Platform. It certifies the software as a Class I medical device under EU MDR 2017/745, justifying the classification based on its function as a data collection tool rather than a diagnostic aid. The declaration is signed by CEO Eduardo Lizana and references applicable technical standards in Annex A.","Regulatory Compliance,Medical Device Regulation,Product Classification,Legal Documentation,EU MDR",internal,,,,,
doc_273,List of Medical Devices.docx,docx,9527,,/Users/eduardolizana/Documents/6. Companies /1. Companies with Rodrigo/KeepMeCompany/7. Administratives/3. QMS Documentation/1. Released Documents/2. Product/List of Medical Devices.docx,7. Administratives/3. QMS Documentation/1. Released Documents/2. Product,triaged,no,structured,no,This document is a template for a medical device list within the Quality Management System. It contains section headers for current and previous devices but lacks any specific product information or filled-in data.,"QMS,Medical Devices,Regulatory,Product Documentation,Compliance",internal,,,,,
doc_274,User Needs List.docx,docx,10321,,/Users/eduardolizana/Documents/6. Companies /1. Companies with Rodrigo/KeepMeCompany/7. Administratives/3. QMS Documentation/1. Released Documents/2. Product/User Needs List.docx,7. Administratives/3. QMS Documentation/1. Released Documents/2. Product,triaged,yes,structured,no,This document defines the purpose and scope for the User Needs List within the Quality Management System. It cites specific medical device regulations such as EU MDR 2017/745 and ISO 13485 to establish the compliance framework for the AI phone service. The provided text lists document structure headers but does not contain the actual user requirements.,"QMS,Regulatory Compliance,Medical Device,Software Development,Product Requirements",internal,,,,,
doc_275,User Needs Review Checklist.docx,docx,9222,,/Users/eduardolizana/Documents/6. Companies /1. Companies with Rodrigo/KeepMeCompany/7. Administratives/3. QMS Documentation/1. Released Documents/2. Product/User Needs Review Checklist.docx,7. Administratives/3. QMS Documentation/1. Released Documents/2. Product,triaged,no,structured,no,"This document is a Quality Management System checklist template used to validate user needs for the AI Doctor & Patient Consultation Platform. It lists sections for scope, comments, and signatures but contains minimal filled-in data beyond a single approval result. The file serves as an administrative record for regulatory compliance within the product development lifecycle.","QMS,Product Development,Regulatory Compliance,User Needs,Health-Tech",internal,,,,,
doc_276,Checklist_ Software Release.docx,docx,10802,,/Users/eduardolizana/Documents/6. Companies /1. Companies with Rodrigo/KeepMeCompany/7. Administratives/3. QMS Documentation/1. Released Documents/4. Software/Checklist_ Software Release.docx,7. Administratives/3. QMS Documentation/1. Released Documents/4. Software,triaged,yes,structured,no,"This document outlines a software release checklist used to verify completion of documentation and processes prior to product version release. It references specific Standard Operating Procedures (SOPs) governing product registration, development plans, and integrated software development. The checklist includes sections for version identification, process verification, and documentation mapping for version 1.0.","Quality Management System,Software Release,Compliance,Process Documentation",internal,,,,,
doc_277,List of Known Anomalies.docx,docx,8940,,/Users/eduardolizana/Documents/6. Companies /1. Companies with Rodrigo/KeepMeCompany/7. Administratives/3. QMS Documentation/1. Released Documents/4. Software/List of Known Anomalies.docx,7. Administratives/3. QMS Documentation/1. Released Documents/4. Software,triaged,maybe,structured,no,"This document outlines the scope for a software release version 1.0, identifying it as a list of known residual anomalies or bugs. However, the document appears to be a template or incomplete, as the section detailing specific anomalies and other tables are empty. It confirms the existence of a release process but lacks substantive technical details.","QMS,Software Release,Version Control,Bug Tracking,Internal Documentation",technical,,,,,
doc_278,SOP Deployment.docx,docx,10805,,/Users/eduardolizana/Documents/6. Companies /1. Companies with Rodrigo/KeepMeCompany/7. Administratives/3. QMS Documentation/1. Released Documents/4. Software/SOP Deployment.docx,7. Administratives/3. QMS Documentation/1. Released Documents/4. Software,triaged,yes,mixed,no,"This document is a Standard Operating Procedure (SOP) detailing the deployment, installation, and integration processes for the company's medical device software. It outlines infrastructure qualification requirements, mandates signed sales contracts before installation, and defines monitoring activities to ensure device performance and safety. The procedure emphasizes compliance controls and version management within the Quality Management System.","QMS,Deployment,Medical Device,Compliance,Operations",internal,,,,,
doc_279,SOP Software Development.docx,docx,133413,,/Users/eduardolizana/Documents/6. Companies /1. Companies with Rodrigo/KeepMeCompany/7. Administratives/3. QMS Documentation/1. Released Documents/4. Software/SOP Software Development.docx,7. Administratives/3. QMS Documentation/1. Released Documents/4. Software,triaged,yes,structured,no,"This document is a Standard Operating Procedure (SOP) defining the software development lifecycle for medical device products. It outlines compliance with international standards such as IEC 62304 and ISO 14971, covering stages from user needs to design and architecture. The process emphasizes risk management, verification, and validation to ensure safety and intended performance.","Software Development,Quality Management System,Medical Device Compliance,Regulatory Standards,Engineering Process",technical,,,,,
doc_280,SOP Software Problem Resolution.docx,docx,10010,,/Users/eduardolizana/Documents/6. Companies /1. Companies with Rodrigo/KeepMeCompany/7. Administratives/3. QMS Documentation/1. Released Documents/4. Software/SOP Software Problem Resolution.docx,7. Administratives/3. QMS Documentation/1. Released Documents/4. Software,triaged,yes,structured,no,"This document outlines the Standard Operating Procedure for resolving software problems within the company's quality management system. It details the workflow for reporting, investigating, and verifying issues related to medical device software, emphasizing patient safety and risk management compliance. The process covers problem classification, root cause analysis, and annual trend reviews to update risk files.","Software Development,Quality Management System,Medical Device Compliance,Risk Management,Standard Operating Procedure",internal,,,,,
