doc_id,filename,file_type,file_size,char_count,path,folder,status,include,content_type,sensitivity_flag,summary,topic_tags,audience,preprocessing_complete,extraction_quality,processed_char_count,chunking_complete,chunk_count
doc_337,Intended Use.docx,docx,10090,,/Users/eduardolizana/Documents/6. Companies /1. Companies with Rodrigo/KeepMeCompany/7. Administratives/3. QMS Documentation/1. Released Documents/5. Technical/Intended Use.docx,7. Administratives/3. QMS Documentation/1. Released Documents/5. Technical,triaged,yes,structured,no,"This document defines the intended use and operational scope of the 'AI Doctor & Patient Consultation Platform' within NHS GP practices. It outlines the six-step operating principle, user profiles, and safety constraints, emphasizing that clinical decisions remain with medical staff. The text serves as a technical specification within the Quality Management System to define product boundaries and compliance requirements.","Product Specification,QMS,AI Healthcare,GP Practices,Compliance",technical,,,,,
doc_338,MDR Classification Document.docx,docx,15374,,/Users/eduardolizana/Documents/6. Companies /1. Companies with Rodrigo/KeepMeCompany/7. Administratives/3. QMS Documentation/1. Released Documents/5. Technical/MDR Classification Document.docx,7. Administratives/3. QMS Documentation/1. Released Documents/5. Technical,triaged,yes,mixed,yes,"This document formally classifies the KeepMeCompany software as a Class I medical device under EU MDR 2017/745 regulations. It provides a justification based on Rule 11, explaining that the software acts as a communication tool without diagnostic or therapeutic decision-making capabilities. The file includes regulatory references, definitions, and sections for signatures and revision history typical of Quality Management System (QMS) documentation.","Regulatory Compliance,EU MDR,Product Classification,QMS Documentation,Health-Tech",internal,,,,,
doc_339,List of Qualified Suppliers.docx,docx,9625,,/Users/eduardolizana/Documents/6. Companies /1. Companies with Rodrigo/KeepMeCompany/7. Administratives/3. QMS Documentation/1. Released Documents/1. Corporate/List of Qualified Suppliers.docx,7. Administratives/3. QMS Documentation/1. Released Documents/1. Corporate,triaged,no,structured,no,This document serves as a cover page for a list of qualified suppliers within the company's Quality Management System. It outlines the scope of the supplier qualification process and references the associated SOP Purchasing document. The document includes metadata fields for signatures and revision history but does not list the actual suppliers.,"QMS,Procurement,Compliance,Administrative,Vendor Management",internal,,,,,
doc_340,Management Review Report.docx,docx,14387,,/Users/eduardolizana/Documents/6. Companies /1. Companies with Rodrigo/KeepMeCompany/7. Administratives/3. QMS Documentation/1. Released Documents/1. Corporate/Management Review Report.docx,7. Administratives/3. QMS Documentation/1. Released Documents/1. Corporate,triaged,yes,structured,no,"This Management Review Report evaluates the Quality Management System (QMS) for KeepMeCompany's AI-driven phone agent system. It reports strong performance in GP consultations and reduced patient waiting times, while identifying EHR integration as a future improvement area. The document outlines KPI acceptance criteria and includes management signatures dated November 2024.","Quality Management System,AI Phone Agents,NHS GP Operations,KPI Review,Product Performance",internal,,,,,
doc_341,SOP Management Review.docx,docx,13147,,/Users/eduardolizana/Documents/6. Companies /1. Companies with Rodrigo/KeepMeCompany/7. Administratives/3. QMS Documentation/1. Released Documents/1. Corporate/SOP Management Review.docx,7. Administratives/3. QMS Documentation/1. Released Documents/1. Corporate,triaged,yes,structured,no,"This Standard Operating Procedure defines the protocol for annual Management Reviews of the company's Quality Management System (QMS). It outlines required inputs like audit results and KPIs, as well as outputs regarding strategic goals and resource allocation to ensure ISO 13485:2016 compliance. The document includes empty placeholders for specific management personnel names and signature tables.","Quality Management System,ISO 13485,Operational SOP,Regulatory Compliance,Internal Governance",internal,,,,,
doc_342,SOP Purchasing.docx,docx,12633,,/Users/eduardolizana/Documents/6. Companies /1. Companies with Rodrigo/KeepMeCompany/7. Administratives/3. QMS Documentation/1. Released Documents/1. Corporate/SOP Purchasing.docx,7. Administratives/3. QMS Documentation/1. Released Documents/1. Corporate,triaged,yes,structured,no,"This document outlines the Standard Operating Procedure for purchasing goods and services within the company's Quality Management System. It details supplier qualification criteria, criticality assessment based on medical device safety and regulatory compliance, and the roles of different departments in the procurement process. The SOP ensures that all purchased items meet quality standards required for the final product.","Quality Management System,Supply Chain,Regulatory Compliance,Procurement,Medical Device",internal,,,,,
doc_343,SOP Sales.docx,docx,11380,,/Users/eduardolizana/Documents/6. Companies /1. Companies with Rodrigo/KeepMeCompany/7. Administratives/3. QMS Documentation/1. Released Documents/1. Corporate/SOP Sales.docx,7. Administratives/3. QMS Documentation/1. Released Documents/1. Corporate,triaged,yes,structured,yes,"This Standard Operating Procedure defines the sales and marketing protocols for medical devices, emphasizing regulatory compliance with EU MDR 2017/745 and German MPDG laws. It mandates quality team approval for all marketing claims and restricts sales to certified products only. The document outlines training requirements for consultants and establishes workflows for customer contract offers.","Sales Operations,Regulatory Compliance,Quality Management,Medical Devices,Marketing Policy",internal,,,,,
doc_344,Supplier Qualification Checklist.docx,docx,13425,,/Users/eduardolizana/Documents/6. Companies /1. Companies with Rodrigo/KeepMeCompany/7. Administratives/3. QMS Documentation/1. Released Documents/1. Corporate/Supplier Qualification Checklist.docx,7. Administratives/3. QMS Documentation/1. Released Documents/1. Corporate,triaged,yes,mixed,no,"This document details the internal Quality Management System (QMS) protocol for evaluating and qualifying third-party suppliers. It specifies technical performance metrics for AI model providers, including uptime and latency targets for the company's patient-facing phone system. The checklist defines criticality assessment criteria based on safety, performance, and regulatory compliance impacts.","Supplier Management,QMS,AI Infrastructure,Compliance,Third-Party Risk",internal,,,,,
doc_345,Audit Plan Template.docx,docx,8969,,/Users/eduardolizana/Documents/6. Companies /1. Companies with Rodrigo/KeepMeCompany/7. Administratives/3. QMS Documentation/7. Post Market (Templates)/Audit Plan Template.docx,7. Administratives/3. QMS Documentation/7. Post Market (Templates),triaged,no,structured,no,"This document is a blank template for an Audit Plan used within the company's Quality Management System. It lists standard sections for audit participants, criteria, and activities without any specific data or narrative. It serves as a structural guide for future compliance documentation.","QMS,Compliance,Audit,Template,Post Market",internal,,,,,
doc_346,Audit Report.docx,docx,10627,,/Users/eduardolizana/Documents/6. Companies /1. Companies with Rodrigo/KeepMeCompany/7. Administratives/3. QMS Documentation/7. Post Market (Templates)/Audit Report.docx,7. Administratives/3. QMS Documentation/7. Post Market (Templates),triaged,yes,mixed,no,This document is an Audit Report for the AI Phone Intake Service confirming compliance with the ISO 13485:2016 standard. It states that no major or minor nonconformities were found and no corrective actions are required at this time. The report concludes that the quality management system is effectively implemented and maintained.,"ISO 13485,Quality Management System,Regulatory Compliance,AI Phone Intake Service,Audit Report",internal,,,,,
doc_347,Bug Fixes Documentation List.docx,docx,9401,,/Users/eduardolizana/Documents/6. Companies /1. Companies with Rodrigo/KeepMeCompany/7. Administratives/3. QMS Documentation/7. Post Market (Templates)/Bug Fixes Documentation List.docx,7. Administratives/3. QMS Documentation/7. Post Market (Templates),triaged,no,structured,no,"This document is a blank template for a Bug Fix Report used within the company's Quality Management System. It outlines the required fields for documenting software issues, corrective actions, and testing results according to internal SOPs. The form is currently empty with most fields marked as pending.","QMS,Software Development,Compliance,Bug Tracking,Templates",internal,,,,,
doc_348,CAPA Plan.docx,docx,10080,,/Users/eduardolizana/Documents/6. Companies /1. Companies with Rodrigo/KeepMeCompany/7. Administratives/3. QMS Documentation/7. Post Market (Templates)/CAPA Plan.docx,7. Administratives/3. QMS Documentation/7. Post Market (Templates),triaged,maybe,structured,no,"This document is a template for a Corrective and Preventive Action (CAPA) plan used within the company's Quality Management System. It outlines the scope, qualification scoring criteria, and required sections for documenting quality incidents, though no specific actions or data are currently filled in. The scoring criteria specify thresholds for initiating CAPAs, reflecting the organization's risk management approach.","Quality Management System,Compliance,Healthcare,Process Documentation,Regulatory",internal,,,,,
doc_349,CAPA Report.docx,docx,8599,,/Users/eduardolizana/Documents/6. Companies /1. Companies with Rodrigo/KeepMeCompany/7. Administratives/3. QMS Documentation/7. Post Market (Templates)/CAPA Report.docx,7. Administratives/3. QMS Documentation/7. Post Market (Templates),triaged,no,mixed,no,"This document is a Corrective and Preventive Action (CAPA) report template from the Quality Management System (QMS). It outlines the scope and sections for documenting corrective actions but contains mostly placeholder text marked as 'PENDING'. The status field indicates 'Closed' despite the pending actions, suggesting an incomplete or draft record.","QMS,Compliance,Healthcare,Process,Documentation",internal,,,,,
doc_350,Change Evaluation Report.docx,docx,8940,,/Users/eduardolizana/Documents/6. Companies /1. Companies with Rodrigo/KeepMeCompany/7. Administratives/3. QMS Documentation/7. Post Market (Templates)/Change Evaluation Report.docx,7. Administratives/3. QMS Documentation/7. Post Market (Templates),triaged,no,structured,no,"This document is a blank template for a Change Evaluation Report used within the company's Quality Management System. It outlines the required sections for documenting change requests, verification, and significance assessment according to SOP Change Management. The form references regulatory obligations regarding Notified Bodies but contains no actual data or filled-in details.","QMS,Regulatory Compliance,Change Management,Medical Device,Template",internal,,,,,
doc_351,Change Request.docx,docx,9695,,/Users/eduardolizana/Documents/6. Companies /1. Companies with Rodrigo/KeepMeCompany/7. Administratives/3. QMS Documentation/7. Post Market (Templates)/Change Request.docx,7. Administratives/3. QMS Documentation/7. Post Market (Templates),triaged,no,structured,no,"This document is a blank Change Request template utilized within the company's Quality Management System. It outlines the required fields and approval workflow for initiating product changes according to a specific SOP. The form includes sections for scope, description, and approvals but remains unfilled with placeholder text.","QMS,Change Management,Compliance,Internal Process,Templates",internal,,,,,
doc_352,Incident Assessment Form.docx,docx,10815,,/Users/eduardolizana/Documents/6. Companies /1. Companies with Rodrigo/KeepMeCompany/7. Administratives/3. QMS Documentation/7. Post Market (Templates)/Incident Assessment Form.docx,7. Administratives/3. QMS Documentation/7. Post Market (Templates),triaged,yes,mixed,yes,This document is a template for assessing and reporting medical device incidents within the company's Quality Management System. It outlines the regulatory criteria for determining reportable events under EU MDR 2017/745 and references internal SOPs for vigilance procedures. The form serves as a standardized tool for compliance teams to evaluate potential safety issues and determine if they require reporting to competent authorities.,"QMS,Regulatory Compliance,Medical Device Regulation,Incident Reporting,Vigilance",internal,,,,,
doc_353,List of CAPAs.docx,docx,7902,,/Users/eduardolizana/Documents/6. Companies /1. Companies with Rodrigo/KeepMeCompany/7. Administratives/3. QMS Documentation/7. Post Market (Templates)/List of CAPAs.docx,7. Administratives/3. QMS Documentation/7. Post Market (Templates),triaged,no,structured,no,"This document is a template header for a Quality Management System list of Corrective and Preventive Actions (CAPAs). It includes metadata such as a document ID and scope definition, along with placeholders for signature and revision history tables. No actual corrective actions or incident data are present in this file.","QMS,CAPA,Compliance,Templates,Post Market",internal,,,,,
doc_354,Post-Market Clinical Follow-Up Evaluation Report.docx,docx,22661,,/Users/eduardolizana/Documents/6. Companies /1. Companies with Rodrigo/KeepMeCompany/7. Administratives/3. QMS Documentation/7. Post Market (Templates)/Post-Market Clinical Follow-Up Evaluation Report.docx,7. Administratives/3. QMS Documentation/7. Post Market (Templates),triaged,yes,structured,yes,"This document serves as a Post-Market Clinical Follow-Up Evaluation Report for the AI Phone Intake Service. It details the device's core functionality, technical infrastructure, and compliance measures regarding GDPR and NHS data security standards. The report outlines implementation processes, user demographics, and security protocols for GP practice integration.","Regulatory Compliance,Product Functionality,Healthcare AI,Data Security,QMS Documentation",internal,,,,,
doc_355,Post-Market Surveillance Report.docx,docx,223217,,/Users/eduardolizana/Documents/6. Companies /1. Companies with Rodrigo/KeepMeCompany/7. Administratives/3. QMS Documentation/7. Post Market (Templates)/Post-Market Surveillance Report.docx,7. Administratives/3. QMS Documentation/7. Post Market (Templates),triaged,no,mixed,no,"This document is a template for a Post-Market Surveillance Report used for medical device compliance. It outlines required sections for vigilance data, complaints, and incident reporting, referencing external regulatory databases like FDA and BfArM.","QMS,Regulatory Compliance,Post-Market Surveillance,Medical Device,Risk Management",internal,,,,,
doc_356,Finances - Costs Tracking and Economics.xlsx,xlsx,372284,,/Users/eduardolizana/Documents/6. Companies /1. Companies with Rodrigo/KeepMeCompany/5. Finances and VCs/Finances - Costs Tracking and Economics.xlsx,5. Finances and VCs,triaged,yes,structured,yes,"This Excel spreadsheet tracks operational expenses and costs for the startup, listing vendors like Heroku, OpenAI, and Google Workspace alongside payment amounts and responsible individuals. It includes entries for regulatory applications such as MHRA and ICO, as well as team salaries and travel expenses across multiple months and currencies. The data provides a detailed view of the company's early-stage burn rate, tech stack costs, and compliance efforts.","Financials,Operational Costs,Regulatory Compliance,Vendor Management,Startup Economics",internal,,,,,
doc_357,Finances - Funding Plan.xlsx,xlsx,98332,,/Users/eduardolizana/Documents/6. Companies /1. Companies with Rodrigo/KeepMeCompany/5. Finances and VCs/Finances - Funding Plan.xlsx,5. Finances and VCs,triaged,yes,structured,yes,"This document contains two Excel sheets detailing the financial funding plan and runway estimation for KeepMeCompany. It outlines monthly operational costs, employee headcount projections, revenue forecasts from GP practices, and total capital requirements in both GBP and USD. The data tracks burn rates and funding needs over a multi-month period to support pilot programs and integrations.","Financial Planning,Funding Strategy,Burn Rate,Operational Costs,Runway Estimation",investors/internal,,,,,
doc_358,Finances - Runway Estimation.xlsx,xlsx,131643,,/Users/eduardolizana/Documents/6. Companies /1. Companies with Rodrigo/KeepMeCompany/5. Finances and VCs/Finances - Runway Estimation.xlsx,5. Finances and VCs,triaged,yes,structured,yes,"This document is a financial runway estimation spreadsheet projecting monthly burn rates and capital depletion over 17 months. It details specific operational costs, founder salaries for Rodrigo and Eduardo, and includes personal expense breakdowns for individual household budgets.","Financial Planning,Runway Analysis,Founder Expenses,Burn Rate,Budgeting",internal,,,,,
doc_359,freeland-coworking--f2024-0489-pdf_1442953337.pdf,pdf,49766,,/Users/eduardolizana/Documents/6. Companies /1. Companies with Rodrigo/KeepMeCompany/5. Finances and VCs/1. Facturas/freeland-coworking--f2024-0489-pdf_1442953337.pdf,5. Finances and VCs/1. Facturas,triaged,yes,structured,yes,"This document is a simplified invoice from Freeland Studio, SL for coworking desk rental addressed to Eduardo Lizana. It details the billing period from October to November 2024, totaling 115.00 EUR including VAT, and confirms payment via RectificadaCard. The footer includes legal compliance information regarding data protection and company registration.","invoices,operational-expenses,coworking,spain,finance",investors,,,,,
doc_360,Agentic Architecture.pdf,pdf,622436,,/Users/eduardolizana/Documents/6. Companies /1. Companies with Rodrigo/KeepMeCompany/5. Finances and VCs/3. Grants/Agentic Architecture.pdf,5. Finances and VCs/3. Grants,excluded-bad-extraction,no,,,File could not be read (empty or unsupported format),,,,,,,
doc_361,Appendix-Architecture.pdf,pdf,973754,,/Users/eduardolizana/Documents/6. Companies /1. Companies with Rodrigo/KeepMeCompany/5. Finances and VCs/3. Grants/Appendix-Architecture.pdf,5. Finances and VCs/3. Grants,excluded-bad-extraction,no,,,File could not be read (empty or unsupported format),,,,,,,
doc_362,Application Grant Info for LLMs (Innovate UK Smart grants_ November 2024).docx,docx,27773,,/Users/eduardolizana/Documents/6. Companies /1. Companies with Rodrigo/KeepMeCompany/5. Finances and VCs/3. Grants/Application Grant Info for LLMs (Innovate UK Smart grants_ November 2024).docx,5. Finances and VCs/3. Grants,triaged,yes,mixed,yes,"This document is a draft Innovate UK Smart grant application submitted by KeepMeCompany Ltd to fund an AI-powered phone system for GP practices. It details the project scope, timeline, and technical integration plans, emphasizing GDPR compliance and NHS efficiency improvements. The text includes both internal project details and a public-facing description of the research phases.","Grant Application,AI Healthcare,NHS,Product Roadmap,Funding Strategy",internal,,,,,
doc_363,Backups.xlsx,xlsx,5920,,/Users/eduardolizana/Documents/6. Companies /1. Companies with Rodrigo/KeepMeCompany/5. Finances and VCs/3. Grants/Backups.xlsx,5. Finances and VCs/3. Grants,triaged,yes,structured,no,"This document is a risk register outlining potential threats across technical, clinical, commercial, and operational categories. It details specific risks such as AI system performance and patient safety, along with mitigation strategies and assigned owners. The file concludes with recommended actions for prioritizing high-impact risks and ensuring cross-functional communication.","Risk Management,Operational Strategy,AI Safety,Compliance,Business Planning",internal,,,,,
doc_364,Project Plan Appendix (18 months total).docx,docx,9572,,/Users/eduardolizana/Documents/6. Companies /1. Companies with Rodrigo/KeepMeCompany/5. Finances and VCs/3. Grants/Project Plan Appendix (18 months total).docx,5. Finances and VCs/3. Grants,triaged,yes,structured,no,"This document outlines an 18-month project plan divided into six work packages covering clinical research, EHR integration, AI development, and compliance. It details specific milestones, dependencies, and deliverables for each phase, including ethics approval and pilot implementation. The plan serves as an operational roadmap for the startup's product development and NHS integration strategy.","project management,product roadmap,clinical validation,AI development,compliance",internal,,,,,
doc_365,Project Plan Appendix (18 months total).pdf,pdf,82398,,/Users/eduardolizana/Documents/6. Companies /1. Companies with Rodrigo/KeepMeCompany/5. Finances and VCs/3. Grants/Project Plan Appendix (18 months total).pdf,5. Finances and VCs/3. Grants,triaged,yes,structured,yes,"This document details an 18-month project plan for KeepMeCompany, outlining six work packages that cover clinical validation, EHR integration, AI development, and pilot implementation. It specifies milestones, dependencies, deliverables, and includes a risk register matrix addressing technical, clinical, and commercial threats with mitigation strategies. The plan emphasizes regulatory compliance, patient safety constraints, and resource coordination for NHS GP practice deployment.","Project Roadmap,Clinical Validation,AI Development,Risk Management,NHS Compliance",investors,,,,,
doc_366,Verification Flow.pdf,pdf,973754,,/Users/eduardolizana/Documents/6. Companies /1. Companies with Rodrigo/KeepMeCompany/5. Finances and VCs/3. Grants/Verification Flow.pdf,5. Finances and VCs/3. Grants,excluded-bad-extraction,no,,,File could not be read (empty or unsupported format),,,,,,,
doc_367,KeepMeCompany - Financial Forecast Grants.xlsx,xlsx,218045,,/Users/eduardolizana/Documents/6. Companies /1. Companies with Rodrigo/KeepMeCompany/5. Finances and VCs/2. Accelerators-VCs/KeepMeCompany - Financial Forecast Grants.xlsx,5. Finances and VCs/2. Accelerators-VCs,triaged,yes,structured,yes,"This document is an Excel spreadsheet containing unit economics parameters and an 18-month cash flow forecast for KeepMeCompany. It outlines variable and fixed operational costs, employee headcount projections, and customer acquisition metrics over two years. The data reflects financial assumptions likely prepared for accelerator or venture capital discussions.","financial_modeling,unit_economics,cash_flow,operational_costs,startup_metrics",investors,,,,,
doc_368,KeepMeCompany - Long Term Strategy - 26 Aug 2024.docx,docx,1170189,,/Users/eduardolizana/Documents/6. Companies /1. Companies with Rodrigo/KeepMeCompany/5. Finances and VCs/2. Accelerators-VCs/KeepMeCompany - Long Term Strategy - 26 Aug 2024.docx,5. Finances and VCs/2. Accelerators-VCs,triaged,yes,prose,yes,"This document outlines the long-term strategic roadmap for KeepMeCompany, focusing on deploying AI phone agents for GP triage and elderly companionship within the UK NHS. It details a three-step growth plan targeting General Practitioners first, then expanding to loneliness reduction services, with projected market sizes of $450MM and $1Bn annually in the UK. The text includes operational data on GP costs and loneliness statistics but leaves competitor analysis sections blank.","Long Term Strategy,Market Sizing,NHS Integration,AI Phone Agents,Elderly Care",investors,,,,,
doc_369,KeepMeCompany - Sept 20th Recap.docx,docx,7996,,/Users/eduardolizana/Documents/6. Companies /1. Companies with Rodrigo/KeepMeCompany/5. Finances and VCs/2. Accelerators-VCs/KeepMeCompany - Sept 20th Recap.docx,5. Finances and VCs/2. Accelerators-VCs,triaged,yes,mixed,yes,"This document outlines the business model and value proposition for KeepMeCompany, an AI-powered phone agent service for UK GP practices. It details the pricing strategy, market size estimates, current development status, and team background. The text serves as a recap likely intended for investors or accelerator partners.","HealthTech,AI,NHS,Business Model,Venture Capital",investors,,,,,
doc_370,KeepMeCompany Intake GTM - Oct 20th 2024.docx,docx,733888,,/Users/eduardolizana/Documents/6. Companies /1. Companies with Rodrigo/KeepMeCompany/5. Finances and VCs/2. Accelerators-VCs/KeepMeCompany Intake GTM - Oct 20th 2024.docx,5. Finances and VCs/2. Accelerators-VCs,triaged,yes,mixed,yes,"This document outlines the Go-To-Market strategy for KeepMeCompany's AI phone agents targeting UK GP practices and Integrated Care Boards. It details a five-phase rollout plan from pilot centers to national scale, including market data on patient volumes and estimated cost savings per GP minute. The plan emphasizes proving value to ICBs to secure distribution and payment models.","GTM Strategy,NHS,UK Healthcare,Market Analysis,Pilot Program",investors,,,,,
doc_371,KeepmeCompany - Bold Vision.docx,docx,9721,,/Users/eduardolizana/Documents/6. Companies /1. Companies with Rodrigo/KeepMeCompany/5. Finances and VCs/2. Accelerators-VCs/KeepmeCompany - Bold Vision.docx,5. Finances and VCs/2. Accelerators-VCs,triaged,yes,prose,no,"This document outlines the strategic vision and business model for KeepMeCompany, an AI startup focused on optimizing UK GP practices. It details the operational problems in primary care, the proposed AI-driven solution, and the founding team's background in tech scaling. The text also covers market opportunities, funding requirements, and the transition from pay-per-task to subscription models.","AI Healthcare,Primary Care,Business Model,Venture Capital,Operational Efficiency",investors,,,,,
